id,title,notes,organization,formats,tags,wfs_url,download_url,has_wfs,license,metadata_modified
parcelmap-bc-parcel-fabric,ParcelMap BC Parcel Fabric,"ParcelMap BC is the current, complete and trusted mapped representation of titled and Crown land parcels across British Columbia, considered to be the point of truth for the graphical representation of property boundaries. It is not the authoritative source for the legal property boundary or related records attributes; this will always be the plan of survey or the related registry information. This particular dataset is a subset of the complete ParcelMap BC data and is comprised of the parcel fa",Data Systems and Services (DataBC),"KML, MULTIPLE, ARCGIS_REST, WMS, FGDB","Cadastre, Crown Land, ICF, Integrated Cadastral Fabric, Interest Parcels, LTSA, Land Ownership, Land Use, Parcels, Private Land, Survey Parcels, Title",,,False,Open Government Licence - British Columbia,2026-03-16T12:49:14.958678
parcelmap-bc-parcel-fabric-fully-attributed,ParcelMap BC Parcel Fabric - Fully Attributed,"ParcelMap BC is the current, complete and trusted mapped representation of titled and Crown land parcels across British Columbia, considered to be the point of truth for the graphical representation of property boundaries. It is not the authoritative source for the legal property boundary or related records attributes; this will always be the plan of survey or the related registry information. This particular dataset is comprised of the parcel fabric and all of the applicable attributes provided",Data Systems and Services (DataBC),MULTIPLE,"Cadastre, Crown Land, ICF, Integrated Cadastral Fabric, Interest Parcels, LTSA, Land Ownership, Land Use, Parcels, Private Land, Survey Parcels, Title",,,False,Access Only,2026-03-16T12:49:13.352945
ngo-conservation-areas-fee-simple,NGO Conservation Areas - Fee Simple,"The __NGO Conservation Areas - Fee Simple__ dataset contains spatial and attribute information for non-governmental organization (NGO) conservation areas in BC. Fee simple NGO conservation areas are private conservation lands owned by non-government organizations and managed for wildlife habitat conservation values. Overlap between this dataset and the provincial [__Conservation Lands__](https://catalogue.data.gov.bc.ca/dataset/conservation-lands) and [__BC Parks, Ecological Reserves and Protect",GeoBC Branch,"MULTIPLE, KML, PDF, WMS","Canadian Wildlife Service, Ducks Unlimited Canada, Land Trust Alliance of British Columbia, NGO, Nature Conservancy of Canada, Nature Trust of British Columbia, conservation, conservation area, conservation land, non-governmental organization",,,False,Open Data Commons - Public Domain Dedication and Licence,2026-03-20T12:42:13.759750
parcelmap-bc-parcel-points,ParcelMap BC Parcel Points,"ParcelMap BC is the current, complete and trusted mapped representation of titled and Crown land parcels across British Columbia, considered to be the point of truth for the graphical representation of property boundaries. It is not the authoritative source for the legal property boundary or related records attributes; this will always be the plan of survey or the related registry information. This particular dataset is a subset of the complete ParcelMap BC data and is comprised of the endpoints",Data Systems and Services (DataBC),MULTIPLE,"Cadastre, Crown Land, ICF, Integrated Cadastral Fabric, Interest Parcels, LTSA, Land Ownership, Land Use, Parcel Point, Parcels, Private Land, Survey Parcels, Title",,,False,Access Only,2026-03-16T12:49:08.807833
parcelmap-bc-parcel-polygons-ogl,ParcelMap BC Parcel Polygons,"ParcelMap BC is the current, complete and trusted mapped representation of titled and Crown land parcels across British Columbia, considered to be the point of truth for the graphical representation of property boundaries. It is not the authoritative source for the legal property boundary or related records attributes; this will always be the plan of survey or the related registry information. This particular dataset is a subset of the complete ParcelMap BC data and is comprised of the parcel po",Data Systems and Services (DataBC),"KML, ORACLE_SDE, WMS, FGDB","Cadastre, Crown Land, ICF, Integrated Cadastral Fabric, Interest Parcels, LTSA, Land Ownership, Land Use, Parcel Polygons, Parcels, Private Land, Survey Parcels, Title",,,False,Open Government Licence - British Columbia,2026-03-16T12:49:12.952563
parcelmap-bc-plans,ParcelMap BC - Plans,"ParcelMap BC is the current, complete and trusted mapped representation of titled and Crown land parcels across British Columbia, considered to be the point of truth for the graphical representation of property boundaries. It is not the authoritative source for the legal property boundary or related records attributes; this will always be the plan of survey or the related registry information.

This ParcelMap BC (PMBC) table contains extended attributes about plans, and establishes the relations",Data Systems and Services (DataBC),MULTIPLE,"Cadastre, ICF, LTSA, Land Ownership, Parcels, Plans, Survey",,,False,Access Only,2026-03-16T12:49:09.165565
parcelmap-bc-common-ownership-cross-reference-table,ParcelMap BC - Common Ownership Cross Reference Table,"ParcelMap BC is the current, complete and trusted mapped representation of titled and Crown land parcels across British Columbia, considered to be the point of truth for the graphical representation of property boundaries. It is not the authoritative source for the legal property boundary or related records attributes; this will always be the plan of survey or the related registry information.

This ParcelMap BC (PMBC) table is used to establish the relationship between bare land strata Common P",Data Systems and Services (DataBC),MULTIPLE,"Cadastre, Common Ownership, ICF, LTSA, Land Ownership, Ownership, Parcels, Plans, Survey",,,False,Access Only,2026-03-16T12:49:06.997671
parcelmap-bc-shared-geometry-cross-reference-table,ParcelMap BC - Shared Geometry Cross Reference Table,"ParcelMap BC is the current, complete and trusted mapped representation of titled and Crown land parcels across British Columbia, considered to be the point of truth for the graphical representation of property boundaries. It is not the authoritative source for the legal property boundary or related records attributes; this will always be the plan of survey or the related registry information.

This ParcelMap BC (PMBC) table is used to establish the relationship between individual Building Strat",Data Systems and Services (DataBC),MULTIPLE,"Cadastre, ICF, LTSA, Land Ownership, PID, Parcels, Plans, Strata",,,False,Access Only,2026-03-16T12:49:07.314443
parcelmap-bc-parcel-polygons-fully-attributed,ParcelMap BC Parcel Polygons - Fully Attributed,"ParcelMap BC is the current, complete and trusted mapped representation of titled and Crown land parcels across British Columbia, considered to be the point of truth for the graphical representation of property boundaries. It is not the authoritative source for the legal property boundary or related records attributes; this will always be the plan of survey or the related registry information. This particular dataset is a subset of the complete ParcelMap BC data and is comprised of the parcel fa",Data Systems and Services (DataBC),MULTIPLE,"Cadastre, Crown Land, ICF, Integrated Cadastral Fabric, Interest Parcels, LTSA, Land Ownership, Land Use, Parcel Polygons, Parcels, Private Land, Survey Parcels, Title",,,False,Access Only,2026-03-16T12:49:13.701493
parcelmap-bc-control-points,ParcelMap BC - Control Points,"ParcelMap BC is the current, complete and trusted mapped representation of titled and Crown land parcels across British Columbia, considered to be the point of truth for the graphical representation of property boundaries. It is not the authoritative source for the legal property boundary or related records attributes; this will always be the plan of survey or the related registry information.

ParcelMap BC (PMBC) control points are physically marked locations with known coordinates in a defined",Data Systems and Services (DataBC),MULTIPLE,"Cadastre, Control Points, ICF, LTSA, Land Ownership, Parcels, Plans, Survey",,,False,Access Only,2026-03-16T12:49:08.472613
indian-reserves-administrative-boundaries,Indian Reserves - Administrative Boundaries,"Provide the administrative boundaries (extent) of Canada Lands which includes Indian Reserves.   Administrative boundaries were compiled from Legal Surveys Division's cadastral datasets and survey records archived in the Canada Lands Survey Records. See the Natural Resource Canada's GeoGratis website, Aboriginal Lands.",GeoBC Branch,"MULTIPLE, KML, WMS","Boundaries, Canada Lands, Cree Naskapi, First Nations lands, Indian Reserve, Kanesatake, LSD, Yukon First Nations, aboriginal lands, marine parks, property rights, settlement area",,,False,Open Government Licence - Canada,2026-02-27T14:03:15.696091
indian-reserves-and-band-names-administrative-boundaries,Indian Reserves and Band Names - Administrative Boundaries,"Provide the administrative boundaries (extent) of Canada Lands which includes Indian Reserves. Administrative boundaries were compiled from Legal Surveys Division's cadastral datasets and survey records archived in the Canada Lands Survey Records. See the Natural Resource Canada's GeoGratis website, Aboriginal Lands.

Band Name and Number added from NRCan's Indian Reserves In BC listing",GeoBC Branch,"MULTIPLE, KML, WMS","Band Name, Band Number, Boundaries, Canada Lands, First Nations lands, Indian Reserve, aboriginal lands",,,False,Open Government Licence - Canada,2026-02-27T14:03:16.953582
tantalis-temporary-railway-land-grant-sublot,TANTALIS - Temporary Railway Land Grant Sublot,This feature is a parcel usually surveyed under the Land Title Act that subdivides a Railway Land Grant Lot that was surveyed under the Land Act. These sub lots vary greatly in size and can be many thousands of acres. Tantalis is an information system designed specifically for the needs of the complex workings of Crown Land Registry and to provide automated support for all aspects of Crown land administration. It was designed to provide a foundation for integrating spatial data associated with m,Lands Branch,MULTIPLE,"CLRS, Canada, Crown Land Registry, Crown Lands, tantalis",,,False,Access Only,2026-03-20T12:42:03.044750
tantalis-temporary-transportation,TANTALIS - Temporary Transportation,"A temporary layer containing CLRS surveyed highways, railways and road parcels in the old CDMS format. Transportation layer from which layers such as transportation corridors are extracted.Tantalis is an information system designed specifically for the needs of the complex workings of Crown Land Registry and to provide automated support for all aspects of Crown land administration. It was designed to provide a foundation for integrating spatial data associated with mapping of survey plans and ad",Lands Branch,MULTIPLE,"CLRS, Canada, Crown Land Registry, Crown Lands, tantalis",,,False,Access Only,2026-03-20T12:42:04.189876
tantalis-land-districts,TANTALIS - Land Districts,TA_LAND_DISTRICTS_SVW contains the spatial representation (polygon) of the current extent of the administrative areas defined under Section 2 of the Land Act as Land Districts. The was created to provide a simplified view of this data from the administrative boundaries information in the Tantalis operational system. These administrative regions are defined under Section 2 of the Land Act for the purpose of managing and uniquely identifying cadastral survey parcels,Lands Branch,"MULTIPLE, KML, WMS","CLRS, Canada, Crown Land, Crown Land Registry, Crown Tenure, tantalis",,,False,Open Government Licence - British Columbia,2026-03-20T12:41:20.514430
tantalis-reversions,TANTALIS - Reversions,This feature is a forfeiture of land back to the Crown due to nonpayment of taxes. A forfeiture can be redeemed by the owner or stay reverted to the Crown. Tantalis is an information system designed specifically for the needs of the complex workings of Crown Land Registry and to provide automated support for all aspects of Crown land administration. It was designed to provide a foundation for integrating spatial data associated with mapping of survey plans and administrative boundaries with attr,Lands Branch,MULTIPLE,"CLRS, Canada, Crown Land Registry, Crown Lands, tantalis",,,False,Access Only,2026-03-20T12:43:12.551529
tantalis-acquisitions,TANTALIS - Acquisitions,This feature is a parcel of land  procured  by the Crown. It results in title or administration being transferred from the former owner to the Crown. Tantalis is an information system designed specifically for the needs of the complex workings of Crown Land Registry and to provide automated support for all aspects of Crown land administration. It was designed to provide a foundation for integrating spatial data associated with mapping of survey plans and administrative boundaries with attribute ,Lands Branch,MULTIPLE,"CLRS, Canada, Crown Land Registry, Crown Lands, tantalis",,,False,Access Only,2026-03-20T12:42:05.291514
tantalis-nts-sheets,TANTALIS - NTS Sheets,"NTS mapsheet grid for BC. Tantalis is an information system designed specifically for the needs of the complex workings of Crown Land Registry and to provide automated support for all aspects of Crown land administration. It was designed to provide a foundation for integrating spatial data associated with mapping of survey plans and administrative boundaries with attribute data associated with legal documents and administrative records. The system records and tracks the sale, survey, license, ac",GeoBC Branch,ORACLE_SDE,"CLRS, Canada, Crown Land Registry, Crown Lands, tantalis",,,False,Access Only,2022-01-13T01:43:45.481066
tantalis-bcgs-sheets,TANTALIS - BCGS Sheets,"BCGS map sheet tiles. Tantalis is an information system designed specifically for the needs of the complex workings of Crown Land Registry and to provide automated support for all aspects of Crown land administration. It was designed to provide a foundation for integrating spatial data associated with mapping of survey plans and administrative boundaries with attribute data associated with legal documents and administrative records. The system records and tracks the sale, survey, license, access",GeoBC Branch,ORACLE_SDE,"CLRS, Canada, Crown Land Registry, Crown Lands, tantalis",,,False,Access Only,2022-01-13T01:43:43.662628
tantalis-crown-land-leases,TANTALIS - Crown Land Leases,"TA_CROWN_LEASES_SVW - A Crown Land Lease is a type of land tenure issued under the Land Act. A Land Act Lease is issued where long term tenure is required, where substantial improvements are proposed, and/or where definite boundaries are required in order to avoid land use and property conflicts. The tenure holder is granted the exclusive use and enjoyment of the area. The tenure holder also has the right to exclude or charge the public for use of the land and/or improvements, when this is consi",Lands Branch,"MULTIPLE, KML, WMS","CLRS, Canada, Crown Land, Crown Land Registry, Crown Tenure, tantalis",,,False,Open Government Licence - British Columbia,2026-03-20T12:43:52.248365
tantalis-administrative-areas,TANTALIS - Administrative Areas,"Administration areas - this is the SDE layer from which a number of layers are extracted including: BC Land Assessment Areas;  Incorporated cities, districts, municipalities, towns, or villages; Indian Reserves; BC Land Districts; BC Land Management Regions; BC Land Title Districts; Parks, Reserves or other types of both Federal and Provincial jurisdiction; BC Provincial Electoral Districts;  BC Regional Districts; and BC School Districts. Tantalis is an information system designed specifically ",Lands Branch,MULTIPLE,"CLRS, Canada, Crown Land Registry, Crown Lands, municipal boundaries, municipal boundary, tantalis",,,False,Access Only,2026-03-20T12:40:22.174525
bc-parks-ecological-reserves-and-protected-areas,"BC Parks, Ecological Reserves, and Protected Areas","This dataset contains parks and protected areas managed for important conservation values and are dedicated for the preservation of their natural environments for the inspiration, use and enjoyment of the public. Places of special ecological importance are designated as ecological reserves for scientific research and educational purposes. Source data is Tantalis. 
*April 18, 2018: Prior to this date this dataset had one spatial boundary per park per survey plan that intersected the boundary of ",BC Parks,"MULTIPLE, KML, WMS","BC Parks, Boundaries, Canada, Crown Land, Crown Land Registry, Crown Tenure, Eco Reserves, Ecological Reserves, Parks, Protected Area, Protected Land, Provincial Parks, Tantalis",,,False,Open Government Licence - British Columbia,2026-03-20T12:40:55.726110
tantalis-crown-land-licenses,TANTALIS - Crown Land Licenses,"TA_CROWN_LICENSES_SVW contains the spatial representation (polygon) of active and applied for Land Act Licences. Land Act Licences (chapter 245) is not registerable, does not require a survey, possesses fewer rights than a lease and conveys non-exclusive use. The view was created to provide a simplified presentation of this single tenure type from the disposition information in the Tantalis operational system. The same content could be derived from the TA_CROWN_TENURES_SVW by filtering to this t",Lands Branch,"MULTIPLE, KML, WMS",missing kw,,,False,Open Government Licence - British Columbia,2026-03-20T12:43:49.582292
tantalis-crown-land-rights-of-way,TANTALIS - Crown Land Rights-of-way,"TA_CROWN_RIGHTS_OF_WAY_SVW contains the spatial representation (polygon) of active and applied for Statutory Rights-of-way. Statutory rights-of-way are registerable in a Land Titles office, and are normally issued to authorize linear uses of Crown Land for transportation, communication, energy production and utility developments. They grant tenure holders right of passage for specific purposes and certainty respecting access to the land and use of improvements. They do not convey non-exclusive u",Lands Branch,"MULTIPLE, KML, WMS","CLRS, Canada, Crown Land, Crown Land Registry, Crown Tenure, tantalis",,,False,Open Government Licence - British Columbia,2026-03-20T12:43:54.066211
province-of-british-columbia-legally-defined-administrative-areas-of-bc,Province of British Columbia - Legally Defined Administrative Areas of BC,"This polygon representing the __Province of British Columbia__ was derived from a variety of sources with variable accuracy (e.g. transformed coordinates, old and current representations of natural boundaries, historic surveys, etc.).

This boundary may be updated periodically, as more accurate data becomes available.

A polygon dataset that includes all of the administrative areas currently in the __Administrative Boundaries Management System (ABMS)__ is available [here](https://catalogue.data.",GeoBC Branch,"MULTIPLE, XLSX, KML, WMS","ABMS, Administrative boundaries, British Columbia, Province of British Columbia, province",,,False,Access Only,2026-03-20T12:41:06.335724
tantalis-interest-parcels,TANTALIS - Interest Parcels,"REDIRECTED - The resource that this record references is not distributed but is used in the generation of other, more complete and useful spatial views (SVW). For the latest Interest Parcel information please select from the following links:  
[TANTALIS – Crown Tenures](http://catalogue.data.gov.bc.ca/dataset/tantalis-crown-tenures)  [TANTALIS – Crown Land Development Agreements](http://catalogue.data.gov.bc.ca/dataset/tantalis-crown-land-development-agreements)  [TANTALIS – Crown Land Inclusio",Lands Branch,ORACLE_SDE,"CLRS, Canada, Crown Land Registry, Crown Lands, tantalis",,,False,Access Only,2026-03-20T00:01:11.834870
legally-defined-administrative-areas-of-bc-boundary-locations-internal,Legally Defined Administrative Areas of BC Boundary Locations - Internal,"These point locations were determined from metes and bounds descriptions as written in Letters Patent for the following administrative boundaries:

* Province of BC	

* Regional Districts

* Municipalities

* Electoral Areas

* Islands Trust

* Local Trust Areas

Point locations often represent the beginning or end of a segment defined by a metes and bounds descriptor. Point locations may also represent the intersection of two boundary line segments if it is not a surveyed point (e",GeoBC Branch,ORACLE_SDE,"ABMS, Administrative boundaries, Islands Trust, Local Trust Area, UTM coordinates, electoral areas, electoral boundaries, latitude, longitude, metes and bounds, municipal boundaries, municipality, regional district, regional district boundaries",,,False,Access Only,2026-03-21T00:00:24.832940
legally-defined-administrative-areas-of-bc-boundary-locations,Legally Defined Administrative Areas of BC Boundary Locations,"These point locations were determined from metes and bounds descriptions as written in Letters Patent for the following administrative boundaries:

* Province of BC	

* Regional Districts

* Municipalities

* Electoral Areas

* Islands Trust

* Local Trust Areas

Point locations often represent the beginning or end of a segment defined by a metes and bounds descriptor. Point locations may also represent the intersection of two boundary line segments if it is not a surveyed point (e",GeoBC Branch,"MULTIPLE, XLSX, KML, WMS","ABMS, Administrative boundaries, Islands Trust, Local Trust Area, UTM coordinates, electoral areas, electoral boundaries, latitude, longitude, metes and bounds, municipal boundaries, municipality, regional district, regional district boundaries",,,False,Access Only,2026-03-21T00:00:23.869082
bedrock-geology,Bedrock Geology,"British Columbia Digital Geology is the data source used for the seamless province-wide, up-to-date, and detailed bedrock geology. The bedrock geology is standardized with consistent stratigraphic code and geometries, and integrates all details of compilations from 1:50,000 to 1:250,000. The latest release (Open File 2017-8) is maintained by a geospatial frame data model, which consists of attributed geological contacts and faults as linework, and outcrops or centroids as points attributed with ",BC Geological Survey,"KML, OTHER, XML, WMS, SHP","bedrock geology, digital geology, faults, geology map, lithology, lithostratigraphy",,https://catalogue.data.gov.bc.ca/dataset/ef8476ed-b02d-4f5c-b778-0d44c9126144/resource/aa3a15f8-02fe-49c6-836c-6866c326203d/download/bedrockgeology2018.zip,False,Open Government Licence - British Columbia,2023-08-29T22:13:57.383422
geology-faults,Geology Faults,"Geology faults are part of the British Columbia Digital Geology, which is the data source used for the seamless province-wide, up-to-date, and detailed bedrock geology. The bedrock geology integrates all details of compilations from 1:50,000 to 1:250,000. The data is maintained by a geospatial frame data model with techniques used to simplify the integration process and shorten the time frame from field mapping, compilation, integration, to data delivery. Geology faults with the related data set",BC Geological Survey,"MULTIPLE, KML, SHP, WMS","bedrock geology, digital geology, fault, geology faults",,https://catalogue.data.gov.bc.ca/dataset/c94e0c13-5385-49c1-9922-822e10135fc6/resource/7bd13434-31dd-405f-9e21-c7b2f2e01fc3/download/geologyfaults2018.zip,False,Open Government Licence - British Columbia,2023-08-29T22:24:12.029227
surficial-geology-map-index,Surficial Geology Map Index,"Presented here is a surficial geology map index for British Columbia, which is published as BCGS Open File 2019-03. The 241 maps indexed were produced by the British Columbia Geological Survey, the Geological Survey of Canada (GSC), and Geoscience BC.  Only maps available for digital download are included.  Each map is represented by the actual map extent rather than a bounding box or NTS sheet that it falls within. The surficial geology map index can be viewed, with reports linked to the data, ",BC Geological Survey,"ZIP, PDF, CSV, KMZ","British Columbia Geological Survey, Surficial geology, areal extent, base mapping, compilation, digital download, map index",,,False,Access Only,2022-06-09T23:34:37.356012
surficial-geology-kootenay-region,Surficial Geology - Kootenay Region,Surficial Geology for the Kootenay Region (qgeol_r4),BC Geological Survey,MULTIPLE,"Kootenay Region, Nelson",,,False,Open Government Licence - British Columbia,2021-12-10T22:33:52.090164
geology-quaternary-alluvium-and-cover,Geology Quaternary Alluvium and Cover,"Quaternary Alluvium and Cover is a data set that is represented as a cover layer on the maps of MapPlace. It is part of the British Columbia Digital Geology, which is the data source used for the seamless province-wide, up-to-date, and detailed bedrock geology. The bedrock geology integrates all details of compilations from 1:50,000 to 1:250,000. The data is maintained by a geospatial frame data model with techniques used to simplify the integration process and shorten the time frame from field ",BC Geological Survey,"MULTIPLE, KML, SHP, WMS","alluvium, bedrock geology, digital geology, geology, quaternary",,https://catalogue.data.gov.bc.ca/dataset/b3f58ed8-376f-4962-9657-36297a5f41cf/resource/9a40d16e-72e5-4ade-9985-ebd10eeab2ae/download/geologyquaternary2018.zip,False,Access Only,2023-06-29T14:18:34.157270
