id,title,notes,organization,formats,tags,wfs_url,download_url,has_wfs,license,metadata_modified
trim-water-lines,TRIM Water Lines,"Water features - rivers, lakes, canals, marshes, swamps, reservoirs, falls, rapids, dams, dykes, glaciers, sand bars, etc. (see https://www2.gov.bc.ca/assets/gov/data/geographic/topography/trim/trim_featurecode_list.xls for full list). The TRIM program produces digital maps, which is a collection of coverages to conform with the BC Geographic System layout. TRIM mapping consists of 7,027 mapsheets covering the province of British Columbia at a scale of 1:20 000.",GeoBC Branch,"MULTIPLE, KML, WMS","Canada, Drainage, Hydrology, TRIM, basemap, topographic map",,,False,Access Only,2025-12-16T19:47:39.373320
fadm-public-sustained-yield-units,FADM - Public Sustained Yield Units,"The spatial representation for a Public Sustained Yield Unit, which is an area of Crown land, usually a natural topographic unit determined by drainage areas, managed for sustained yield by the Crown through the Ministry of Forests. It includes all Crown lands within the currently established boundaries of the unit and excludes federal lands, provincial parks, experimental forest reserves, gazetted watersheds and tree farm licences. Crown land designated as a public sustained yield unit under Se",Forest Tenures Branch,"MULTIPLE, KML, WMS","Boundaries, Canada, PSYU, administrative division, forest, forestry",,,False,Open Government Licence - British Columbia,2025-08-20T18:39:29.095914
site-series-by-moisture-regime-east-kootenay,Site Series by Moisture Regime - East Kootenay,Braumandl and Curran Ecosystem Stratification of Site Series by Moisture Regime for the East Kootenay (assmr_ek),Regional Operations - Kootenay Boundary,ORACLE_SDE,"East Kootenay, Kootenay Region, Nelson",,,False,Access Only,2022-01-13T01:41:03.434189
broad-ecosystem-inventory-wildlife-habitat-ratings-interpretations-for-mammals,Broad Ecosystem Inventory Wildlife Habitat Ratings Interpretations for Mammals,"The Broad Ecosystem Inventory (BEI) Classification provides broad regional information about the distribution of ecosystems throughout the province and the value of these ecosystems to wildlife. This work is done in order to facilitate the use of wildlife information in broad provincial and regional land and resource planning initiatives. Broad Ecosystem Units are mapped based on imagery of the provincial land base generally captured at a scale of 1:250,000. BEI mapping represents forest conditi",Ecosystems,"PDF, ORACLE_SDE","BEI, Broad Ecosystem Inventory, Ecosystem Classification, Ecosystem Mapping, WHR, Wildlife Habitat Ratings, badger, bison, bobcat, caribou, deer, elk, furbearer, habitat capability, habitat modelling, habitat suitability, lynx, moose, ungulates",,,False,Open Government Licence - British Columbia,2024-02-08T23:20:48.996148
lidar,LiDAR,"__LiDAR__ (__Li__ght __D__etection __A__nd __R__anging) is a modern survey method that produces three-dimensional spatial information in the form of a data point cloud.

LiDAR is an active remote sensing system; it produces its own energy to acquire information, versus passive systems, like cameras, that only receive energy. 

LiDAR systems are made up of a scanner, which is a laser transmitter and receiver; a GNSS (GPS) receiver; and an inertial navigation system (INS). These instruments are mo",GeoBC Branch,OTHER,"DEM, DSM, LiDAR, data, download, lidar, open, point cloud, portal, remote sensing, web map, webmap",,,False,Open Government Licence - British Columbia,2024-04-18T20:33:20.935380
vegetative-lot-table,Vegetative Lot Table,"Vegetative Lot ID is a unique identifier for a quantity of forest tree seed of a particular species from a given natural stand location or a vegetative orchard, collected at a given time (date range).  Several attributes for a vegetative lot are recorded in the VEG_LOT table including the mean collection geographic coordinates (latitude/longitude), minimum/maximum  collection elevation, Seed Planning Zone, etc.  The Chief Forester's Standards for Seed Use lists the mandatory attribute informatio",Forest Improvement and Research Management Branch,ORACLE_SDE,"Canada, Vegetative Lot, forest, planning",,,False,Access Only,2022-01-13T01:42:10.119542
vri-2024-forest-vegetation-composite-dead-layer-d-,VRI - 2024 - Forest Vegetation Composite Dead Layer (D),"Geospatial forest inventory dataset updated for depletions, such as harvesting, and projected annually for growth. Sample attributes in this dataset include: age, species, volume, height.

The Vegetation Resources Inventory (VRI) spatial datasets describe both where a vegetation resource (ie timber volume, tree species) is located and how much of a given resource is within an inventory unit.

",Forest Analysis and Inventory Branch,"MULTIPLE, KML, WMS, FGDB","Canada, MPB, VRI, forest, forest cover, vegetation cover",,,False,Access Only,2025-05-29T12:41:48.766834
results-forest-cover-species-attribute-only,RESULTS - Forest Cover Species (Attribute Only),"The tree species contained within RESULT's FOREST COVER inventory and silviculture components. This view contains attribute data and is intended to be joined with the other results views to provide additional forest cover polygon species information.  This is a part of Silviculture and Land Status Tracking dataset, which includes trakcing achievement of silviculture obligations on Crown Land.  Non-spatial attribute data delivered in CSV format","Forest Science, Planning and Practices Branch",MULTIPLE,"Canada, forest cover polygon, reforestation, tree species",,,False,Open Government Licence - British Columbia,2026-03-20T12:43:46.969231
vri-historical-vegetation-resource-inventory-2002-2023-,VRI - HISTORICAL Vegetation Resource Inventory (2002 - 2023),"Published by the Ministry of Forests, Lands, Natural Resource Operations and Rural Development - Forest Analysis and Inventory
Geospatial forest inventory dataset updated for depletions, such as harvesting, and projected annually for growth. Sample attributes in this dataset include: age, species, volume, height.

The Vegetation Resources Inventory (VRI) spatial datasets describe both where a vegetation resource (ie timber volume, tree species) is located and how much of a given resource is w",Forest Analysis and Inventory Branch,FGDB,"British Columbia, Canada, Forest, Forest Cover, Historical VRI, VEG, VEG COMP, VEG_COMP, VRI, Vegetation Resource Inventory, vegetation cover",,,False,Open Government Licence - British Columbia,2025-05-28T15:40:14.144099
vri-2024-forest-vegetation-composite-rank-1-layer-r1-,VRI - 2024 - Forest Vegetation Composite Rank 1 Layer (R1),"Geospatial forest inventory dataset updated for depletions, such as harvesting, and projected annually for growth. Sample attributes in this dataset include: age, species, volume, height.

The Vegetation Resources Inventory (VRI) spatial datasets describe both where a vegetation resource (ie timber volume, tree species) is located and how much of a given resource is within an inventory unit.

Suggested citation:
Forest Analysis and Inventory Branch (2024). VRI - 2024 - Forest Vegetation Composit",Forest Analysis and Inventory Branch,"MULTIPLE, KML, WMS, FGDB","Canada, VRI, forest, forest cover, vegetation cover",,,False,Open Government Licence - British Columbia,2025-05-29T12:41:44.490332
biogeoclimatic-projections,Biogeoclimatic Projections,"This spatial data product consists of projected climate conditions classified by biogeoclimatic (BGC) unit across Western North America. Projections can be accessed interactively through the spatial module of the CCISS tool, where users can view projections at both local and provincial scales. Users can download raster data (TIF files) for the entire province or for predefined subregions, for five 20-year periods of the 21st century: 2001-2020, 2021-2040, 2041-2060, 2061-2080, and 2081-2100. 

T",Forest Carbon and Climate Services Branch,"PDF, OTHER","BEC, BGC, Canada, Future Forest Ecosystems Centre, biogeoclimatic, biogeoclimatic ecosystem classification, biogeoclimatic zones, climate change, climate change adaptation, ecological classification, ffec, novel climates, vegetation",,,False,Open Government Licence - British Columbia,2025-06-05T20:57:47.274841
seed-planning-unit-geometry,Seed Planning Unit Geometry,"Seed Planning Unit (SPU) geometry is comprised of Seed Planning Zone geometry delineated by elevation ranges.  Each SEED_PLAN_UNIT_ID relates to a SEED_PLAN_ZONE for a specific tree species and minimum/maximum elevation in meters.  Seed Planning Units only apply to Genetic Class A (orchard/parent tree).  Some coastal species also have a latitude range.  The geometry can be joined to the SEED_PLAN_UNIT table using SEEED_PLAN_UNIT_ID to determine the Seed Planning Zone, tree species and elevation ",Forest Improvement and Research Management Branch,MULTIPLE,"Canada, forest, planning, seed",,,False,Open Government Licence - British Columbia,2021-12-10T22:34:44.721272
seed-planning-zones,Seed Planning Zones,"Seed Planning Zone MVW is a materialized view of SEED_PLAN_ZONE_GEOMETRY polygons joined with the SEED_PLAN_ZONE table.  The materialized view displays the spatial polygons for each Seed Planning Zone (SPZ) for Genetic Class=B (natural stands, all species) and Genetic Class=A (seed orchards, each tree species has specific SPZ geometry).  SPZs are areas of the province that are characterized by common ecological and genetic attributes for a given forest tree species.",Forest Improvement and Research Management Branch,"MULTIPLE, KML, WMS","Canada, forest, planning, seed",,,False,Access Only,2026-03-20T12:44:16.822322
seed-planning-zone-geometry,Seed Planning Zone Geometry,"Seed Planning Zone (SPZ) geometry is comprised of geographic areas of the province that are characterized by common ecological and genetic attributes for a given forest tree species. SPZ's are used for seedlot registration, seed planning, seed transfer and seedlot selection for reforestation. The geometry can be joined to the SEED_PLAN_ZONE table using SEED_PLAN_ZONE_ID to determine if the SPZ is for Genetic Class B (natural stand) or Genetic Class A (orchard/parent tree) and tree species.",Forest Improvement and Research Management Branch,MULTIPLE,"Canada, forest, planning, seed",,,False,Open Government Licence - British Columbia,2021-12-10T22:34:44.279435
seed-planning-units-spatial-view-,Seed Planning Units (Spatial View),"Seed Planning Units SVW is a spatial view designed to provide enhanced attribution that joins:
Seed Planning Unit (SPU) Geometry WHSE_FOREST_VEGETATION.SEED_PLAN_UNIT_GEOMETRY, comprised of Seed Planning Zone (SPZ) geometry delineated by elevation ranges, with
Seed Planning Unit View WHSE_FOREST_VEGETATION.V_SEED_PLAN_UNIT, comprised of valid combinations of Seed Planning Zones and elevation ranges.",Forest Improvement and Research Management Branch,"MULTIPLE, KML, WMS","forest, planning, seed, seedlot",,,False,Access Only,2023-06-29T14:16:37.017788
seed-planning-unit,Seed Planning Unit,Seed Planning Unit View is a table that lists valid combinations of Seed Planning Zones (SPZ) and elevation ranges.  Each SEED_PLAN_UNIT_ID relates to a SEED_PLAN_ZONE for a specific tree species and minimum/maximum elevation in meters.  Seed Planning Units only apply to Genetic Class A (orchard/parent tree).  Some coastal species also have a latitude range.  SPUs are designated as Primary (Y or N) for use in the Seed Planning and Registry application.  SPUs may have a Program Rank and Total See,Forest Improvement and Research Management Branch,MULTIPLE,"Canada, forest, planning, seed, seedlot",,,False,Access Only,2021-12-10T22:34:21.137558
seed-planning-unit-table,Seed Planning Unit Table,Seed Planning Unit Table lists valid combinations of Seed Planning Zones (SPZ) and elevation ranges.  Each SEED_PLAN_UNIT_ID relates to a SEED_PLAN_ZONE for a specific tree species and minimum/maximum elevation in meters.  Seed Planning Units only apply to Genetic Class A (orchard/parent tree).  Some coastal species also have a latitude range.  SPUs are designated as Primary (Y or N) for use in the Seed Planning and Registry application.  SPUs may have a Program Rank and Total Seedling Requireme,Forest Improvement and Research Management Branch,ORACLE_SDE,"Canada, forest, planning, seed",,,False,Access Only,2022-01-13T01:42:08.437938
seedlot-table,Seedlot Table,"Seedlot number is a unique identifier for a quantity of forest tree seed of a particular species from a given natural stand location or a seed orchard, collected at a given time (date range).  Several attributes for a seedlot are recorded in the SEEDLOT table including the mean collection geographic coordinates (latitude/longitude), minimum/maximum  collection elevation, Seed Planning Zone, etc.  The Chief Forester's Standards for Seed Use lists the mandatory attribute information that must be i",Forest Improvement and Research Management Branch,ORACLE_SDE,"Canada, forest, planning, seed",,,False,Access Only,2026-03-20T12:44:17.402939
results-openings-svw,RESULTS - Openings svw,"RESULTS Openings are administrative boundaries for areas harvested with silviculture obligations or natural disturbances with intended forest management activities on Crown Land.  

The RESULTS openings_svw is a spatial view made up of a number of tables containing information on disturbance dates, generalized bec, forest district, opening category, opening status, previous tree species, opening gross area, average slope, average elevation, aspect, along with maximum and minimum elevation valu","Forest Science, Planning and Practices Branch","MULTIPLE, KML, WMS","Canada, disturbance, harvest, opening, reforestation, silviculture",,,False,Open Government Licence - British Columbia,2026-03-20T12:44:37.933084
seed-planning-zone-code-table,Seed Planning Zone Code Table,"Seed Planning Zone Code Table lists the codes and descriptions for Seed Planning Zones (SPZ).  Seed Planning Zones comprise broad geographic areas of the province that are characterized by common ecological and genetic attributes for a given forest tree species. SPZ's are used for seedlot registration, seed planning, seed transfer and seedlot selection for reforestation.",Forest Improvement and Research Management Branch,ORACLE_SDE,"Canada, forest, planning, seed",,,False,Access Only,2022-01-13T01:42:08.856102
bc-wildfire-fire-fuel-types-public,BC Wildfire Fire Fuel Types - Public,"This polygon layer classifies the entire province into fuel types from the Canadian Fire Behaviour Prediction System for the purpose of modeling wildfire behaviour. The source data is primarily from BC Vegetation Resource Inventory (VRI) polyons, using an algorithm based on vegetation attributes (species, tree height, density, biogeoclimatic zone, etc.). Where VRI data was unavailable (Tree Farm Licenses, etc.), data from the Canadian Forest Service national fuel grid was used. This layer has ha",BC Wildfire Service,"KML, OTHER, ORACLE_SDE, MULTIPLE, WMS, FGDB","BC Fuel Types, BCWS, forest fire, fuels, wildfire",,,False,Access Only,2025-05-07T12:53:54.672209
okanagan-conservation-ranking-polygons,Okanagan Conservation Ranking Polygons,"This spatial layer contains the Okanagan Conservation Ranking Polygons, which is part of the Okanagan Region Biodiversity Conservation Strategy (Keeping Nature in Our Future).  Okanagan Conservation Ranking Polygons classifies ecosystems into four relative conservation ranks:  low, moderate, high and very high. This is a multipart polygon feature.",Regional Operations - Thompson Okanagan,"MULTIPLE, KML, WMS","Biodiversity, Okanagan, conservation",,,False,Access Only,2023-06-29T14:15:29.874657
forest-inventory-ground-plot-data-and-interactive-map,Forest Inventory Ground Plot Data and Interactive Map,"The 'Data and Resources' box to the right includes a link to an FTP site where data, and a data dictionary, can be downloaded that provide access to compiled data from the primary ground-sampling programs managed by the Forest Analysis and Inventory Branch (FAIB) as well as a link to and Interactive Mapping App. 

FAIB ground-sampling programs include the Permanent Sample Plots (PSPs) that provide long term growth and yield information to support development and testing of growth-and-yield model",Forest Analysis and Inventory Branch,"CSV, HTML","CMI, FAIB, Forest Monitoring, Ground Plots, Ground Sample Compiler, Monitoring, NFI, PSP, PSPs, VRI, YSM, growth and yield",,,False,Open Government Licence - British Columbia,2025-05-28T21:16:15.486628
indicator-summary-data-long-term-change-in-air-temperature-and-precipitation-in-bc,Indicator Summary Data: Long-term Change in Air Temperature and Precipitation in BC,These tabular datasets contain the results reported in a set of climate change indicators published in [Indicators of Climate Change in British Columbia (2015-16 Update)](http://www2.gov.bc.ca/assets/download/216DBDF5B9504E6B9B29D8E6C0CD2849) and by [Environmental Reporting BC](http://www2.gov.bc.ca/gov/content?id=3C233B4F802A4FE186297EC52311E40C). The analyses used climate monitoring data for B.C. available from the [BC Provincial Climate Data Set](https://www.pacificclimate.org/data/bc-station,Climate Action Secretariat,CSV,"air temperature, climate change, environmental reporting, indicators, precipitation, stateofenvironment",,,False,Open Government Licence - British Columbia,2018-07-12T21:58:45.491178
air-quality-and-climate-monitoring-unverified-hourly-air-quality-and-meteorological-data,Air Quality and Climate Monitoring: Unverified Hourly Air Quality and Meteorological Data,"Unverified raw hourly air pollutant monitoring and meteorological data collected by the Ministry of Environment and Climate Change Strategy. These data sets contain **air quality data from 2025 to the most recent hourly readings** and **meteorological data from 2023 to the most recent hourly readings** from air quality monitoring stations across B.C, up to the latest hour in Pacific Standard Time (PST).  This does not include data originating from Metro Vancouver and Fraser Valley Regional Distr",Environmental Monitoring and Analysis Branch,"CSV, KML","air pollution, air quality, environmental monitoring, environmental reporting, meteorological",,,False,Open Government Licence - British Columbia,2026-01-22T23:11:10.727380
air-quality-and-climate-monitoring-verified-hourly-air-quality-and-meteorological-data,Air Quality and Climate Monitoring: Verified Hourly Air Quality and Meteorological Data,"Verified hourly air pollutant monitoring data and meteorological data prepared and published annually by the Ministry of Environment. These data sets contain **quality-assured air quality hourly readings from 1980 up to the end of 2024 and quality-assured meteorological hourly readings from 1980 up to the end of 2022** from air quality monitoring stations across British Columbia. All data are in Pacific Standard Time. 

Please subscribe using the following link if you want to receive the updates",Environmental Monitoring and Analysis Branch,"CSV, XLSX","Canadian Ambient Air Quality Standard, PM10, PM2.5, Statistical summaries, air pollution, air quality, air quality health index, ambient monitoring, aqhi, carbon monoxide, environmental monitoring, environmental reporting, nitrogen dioxide, ozone, particulate matter",,,False,Open Government Licence - British Columbia,2025-08-06T23:20:29.747051
british-columbia-drought-information-portal,British Columbia Drought Information Portal,"Welcome to the British Columbia Drought Information Portal. 

https://droughtportal.gov.bc.ca

Drought is a recurrent feature of climate involving a deficiency of precipitation over an extended period of time, resulting in a water shortage. The British Columbia Drought Information Portal was created as a single source geographic drought level information system for British Columbians. The application uses multiple embedded apps to provide information on provincial drought levels, angling closure",GeoBC Branch,OTHER,"AGO, AGOL, ArcGIS Online, BC, British Columbia, Canada, Drought, GeoBC, Living Water Smart, Water",,,False,Access Only,2024-05-02T21:50:33.341943
community-watersheds-cancelled,Community Watersheds - Cancelled,"This 1:20,000. scale inventory contains digital maps of cancelled community watershed boundaries. The watershed boundaries showed the location of watersheds that supply communities with domestic water. These are meant to be used in conjunction with stream network map coverages from TRIM mapping. Attribute data for community watersheds can be downloaded into a spreadsheet or database",Aquatic Ecosystems,"MULTIPLE, KML, WMS","Canada, Hydrology, community watershed, domestic water, drinking water, watershed",,,False,Open Government Licence - British Columbia,2025-05-12T12:41:21.894363
priority-watersheds-for-watershed-assessment-vi-1996,"Priority watersheds for watershed assessment, VI 1996","Priority watersheds for watershed assessment, VI 1996",Regional Operations - West Coast,ORACLE_SDE,"Coast Region, Nanaimo, Vancouver Island Region, watersheds",,,False,Access Only,2022-10-26T17:26:50.101238
provincial-fish-ranges-watersheds,Provincial Fish Ranges - Watersheds,"This file contains a representation of 3rd order watersheds developed for the 1:50,000 BC Watershed Atlas with each watershed polygon coded for occurrence of freshwater fish species (including anadromous salmon in their freshwater stages). The initial fish species codes for presence/absence in each watershed were derived from an GIS overlay of fish species occurrences within broadly defined fish regions for BC. This overlay of fish ranges describes the occurrences of fish species in 30 regions t",Knowledge Management,MULTIPLE,"BC Watershed Atlas, distribution, fish presence, fish range, freshwater, watershed",,,False,Open Government Licence - British Columbia,2026-03-20T12:44:58.217678
water-licensing-watersheds,Water Licensing Watersheds,"Groupings of BC Freshwater Atlas (FWA) Assessment Watersheds dissolved to a manageable scale for water licensing. Each Natural Resource Region developed their own process for grouping and naming the watersheds based on the region's water management needs.

For information about the source FWA Assessment Watersheds see: https://catalogue.data.gov.bc.ca/dataset/97d8ef37-b8d2-4c3b-b772-6b25c1db13d0",Water Management,"MULTIPLE, KML, WMS","Water Licence, Watershed, Watershed Code, watershed groups",,,False,Access Only,2024-11-19T13:53:59.287046
freshwater-atlas-watersheds,Freshwater Atlas Watersheds,"All fundamental watershed polygons generated from watershed boundary lines, bank edges, delimiter edges, coastline edges, and administrative boundary edges",GeoBC Branch,"KML, MULTIPLE, PDF, HTML, WMS, FGDB","CWB, FWA, corporate watershed base, freshwater atlas",,,False,Open Government Licence - British Columbia,2024-03-23T14:47:14.495668
domestic-watersheds-kblup,Domestic Watersheds - KBLUP,Domestic Watersheds for the Kootenay Boundary Landuse Plan (ldws_r4),Regional Operations - Kootenay Boundary,MULTIPLE,"Kootenay Region, Nelson",,,False,Open Government Licence - British Columbia,2021-12-10T22:37:45.353869
fisheries-sensitive-watersheds,Fisheries Sensitive Watersheds,The dataset contains approved legal boundaries for fisheries sensitive watersheds. A FSW is a mapped area with specific management objectives intended to guide development activities which may adversely impact important fish values,Aquatic Ecosystems,"MULTIPLE, KML, WMS","FSW, fisheries sensitive watershed, specific management objectives",,,False,Open Government Licence - British Columbia,2025-05-12T12:40:42.331288
freshwater-atlas-assessment-watersheds,Freshwater Atlas Assessment Watersheds,"Assessment Watersheds are mesoscale aquatic units designed to replace the 3rd order 1:50K watersheds. Assessment Watersheds are based on groupings of fundamental watersheds using FWA watershed code and local code, with a target size of between 2,000ha and 10,000ha.",GeoBC Branch,"KML, MULTIPLE, PDF, HTML, WMS","CWB, FWA, corporate watershed base, freshwater atlas",,,False,Open Government Licence - British Columbia,2026-03-07T13:48:49.677817
freshwater-atlas-watershed-boundaries,Freshwater Atlas Watershed Boundaries,All principal and non-principal watershed boundary edges.  These are the linear features that makeup the watershed polygons,GeoBC Branch,"KML, MULTIPLE, PDF, HTML, WMS, FGDB","CWB, FWA, corporate watershed base, freshwater atlas",,,False,Open Government Licence - British Columbia,2024-03-24T14:36:39.893997
freshwater-atlas-named-watersheds,Freshwater Atlas Named Watersheds,All named watershed polygons,GeoBC Branch,"KML, MULTIPLE, PDF, HTML, WMS","CWB, corporate watershed base, freshwater atlas",,,False,Open Government Licence - British Columbia,2026-03-14T12:47:18.516033
freshwater-atlas-watershed-groups,Freshwater Atlas Watershed Groups,"Polygons delimiting the watershed group boundary, which is a collections of drainage areas.  In-land groups will contain a single polygon, coastal groups may contain multiple polygons (one for each island)",GeoBC Branch,"KML, MULTIPLE, PDF, HTML, WMS","CWB, FWA, corporate watershed base, freshwater atlas",,,False,Open Government Licence - British Columbia,2025-05-10T12:48:40.536334
