id,title,notes,organization,formats,tags,wfs_url,download_url,has_wfs,license,metadata_modified
hydrology-100-year-peak-flow-isolines-historical,Hydrology: 100 Year Peak Flow Isolines (Historical),100 year peak flow isolines in cubic metres per second (m3/s) for 100 square kilometre watersheds and 100 year return period,Environmental Monitoring and Analysis Branch,"MULTIPLE, KML, WMS","hydrology, isoline, peak flow, stream flow",,,False,Open Government Licence - British Columbia,2023-06-29T14:16:18.664583
hydrology-10-year-peak-flow-isolines-historical,Hydrology: 10 Year Peak Flow Isolines (Historical),10 year peak flow isolines in cubic metres per second (m3/s) for 100 square kilometre watersheds and 10 year return period,Environmental Monitoring and Analysis Branch,"MULTIPLE, KML, WMS","hydrology, isoline, peak flow, stream flow",,,False,Open Government Licence - British Columbia,2023-06-29T14:15:32.000628
hydrology-normal-annual-runoff-isolines-1961-1990-historical,Hydrology: Normal Annual Runoff Isolines (1961 - 1990) - Historical,"Normal Annual Runoff for 1961 - 1990, in mm",Environmental Monitoring and Analysis Branch,"MULTIPLE, KML, WMS","hydrology, isoline, peak flow, stream flow",,,False,Open Government Licence - British Columbia,2023-06-29T14:22:00.489786
atlas-of-canada-1-000-000-national-frameworks-data-hydrology-rivers,"Atlas of Canada 1,000,000 National Frameworks Data - Hydrology Rivers","DEPRECATED: The National Scale Frameworks Hydrology data consists of area, linear and point geospatial and attribute data for Canada's hydrology at a national scale. It provides a representation of Canada's surface water features, and data completeness reflects the content of the source, the original Vector Map level 0 (VMAP0) revision 4 hydrographic layers, except where revision editing has been performed. Key value-added characteristics 
include river flow direction, connectivity and the tagg",GeoBC Branch,ORACLE_SDE,rivers and streams,,,False,Access Only,2022-01-13T01:42:36.411021
atlas-of-canada-1-000-000-national-frameworks-data-hydrology-lakes,"Atlas of Canada 1,000,000 National Frameworks Data - Hydrology Lakes","DEPRECATED: 1:1million Lakes from the Natural Resources Canada GeoGratis portal provided by the Earth Sciences Sector.

This has been replaced with [WHSE_BASEMAPPING.NRC_WATERBODIES_1M_SP](https://catalogue.data.gov.bc.ca/dataset/d8090b02-55b6-4117-b876-0b77b6b9ab18)",GeoBC Branch,ORACLE_SDE,"000, Lakes 1 1, Lakes 1 1million",,,False,Access Only,2022-01-13T01:42:24.687752
clever-model-map,CLEVER Model Map,"The CLEVER model is a hydrologic model used by the River Forecast Centre to forecast hydrologic conditions at locations around British Columbia. This map provides mapped output from the CLEVER model 10-Day forecasts against assessed return period flows at Water Survey of Canada locations.

For detailed information on the CLEVER Model, see the Technical Reference Guide.",River Forecast Centre,ARCGIS_REST,"AGO, BC, British Columbia, CLEVER, Canada, Flood, Freshet, Streamflow, hydrology, water",,,False,Access Only,2023-02-17T23:27:14.785678
water-reservations-points,Water Reservations - Points,"Province-wide spatial view showing the most downstream point of a stream or drainage system, established by Order-in-Council as a Water Reservation. This layer is updated daily.",Water Management,"KML, ORACLE_SDE, WMS","Canada, Hydrology, WLS, WSA, Water Sustainability Act, canada, hydrology, water licensing, water management, water reservation, water reserve, water rights, water sustainability act, wls, wsa",,,False,Open Government Licence - British Columbia,2026-03-20T12:40:50.750212
water-allocation-notation-points,Water Allocation Notation - Points,"Province-wide spatial view showing the most downstream point of a stream, as determined by Water Allocation staff, to have a current or potential water quantity/quality concern. Note: This layer has replaced the older Water Allocation Restrictions view spatial layer. This data is updated nightly.",Water Management,"KML, ORACLE_SDE, WMS","Canada, Hydrology, aquifer, canada, hydrogeology, hydrology, quality, quantity, stream, water Allocation Notation, water allocation notation, water allocation restriction, water licensing, water management, water notation, water rights",,,False,Open Government Licence - British Columbia,2026-03-20T12:43:08.722938
water-survey-of-canada-sub-sub-drainage-areas,Water Survey of Canada Sub-Sub-Drainage Areas,"Atlas of Canada 1,000,000 National Frameworks Data, Hydrology - Drainage Areas (WSC sub-sub drainage areas) from the Natural Resources Canada GeoGratis website. The dataset has been clipped to drainage areas within or adjacent to B.C. ",Environmental Monitoring and Analysis Branch,"MULTIPLE, KML, WMS","WSC, basins, drainage areas, drainages, hydrology, water survey of canada, watersheds",,,False,Open Government Licence - Canada,2023-06-29T14:15:40.269908
indicator-summary-data-change-in-timing-and-volume-of-river-flow-in-bc-1912-2012-,Indicator Summary Data: Change in Timing and Volume of River Flow in BC (1912-2012),This tabular dataset is the result of an analysis supporting the indicator 'Change in Timing and Volume of River Flow in BC' published in [Indicators of Climate Change for British Columbia (2015-16 Update)](http://www2.gov.bc.ca/assets/download/216DBDF5B9504E6B9B29D8E6C0CD2849) and on [Environmental Reporting BC](http://www.env.gov.bc.ca/soe/indicators/climate-change/rivers.html). The analysis used river flow monitoring data for B.C. available from the [the Environment and Climate Change Canada ,Climate Action Secretariat,CSV,"climate change, environmental reporting, hydrology, indicator, river flow, stateofenvironment, surface water",,,False,Open Government Licence - British Columbia,2018-07-12T18:52:05.203215
snow-survey-administrative-basin-areas,Snow Survey Administrative Basin Areas,"Snow survey administrative basin areas, which are components of the BC snow survey network. Basin codes are used as basis of snow survey station names, and for some reporting purposes.",Environmental Monitoring and Analysis Branch,"MULTIPLE, KML, WMS","hydrology, snow, snow survey",,,False,Open Government Licence - British Columbia,2023-06-29T14:12:30.794154
automated-snow-weather-station-locations,Automated Snow Weather Station Locations,"Locations of automated snow weather stations, active and inactive. Automated snow weather stations are components of the BC snow survey network.  ",Environmental Monitoring and Analysis Branch,"MULTIPLE, KML, WMS","automated snow pillows, automated snow weather stations, climate related monitoring, cryosphere, hydrology, snow, snow survey",,,False,Open Government Licence - British Columbia,2026-03-20T12:43:10.555100
manual-snow-survey-locations,Manual Snow Survey Site Locations,Manual snow survey (active & inactive) locations as part of the BC Snow Survey program. ,Environmental Monitoring and Analysis Branch,"MULTIPLE, KML, WMS","hydrology, snow, snow survey",,,False,Open Government Licence - British Columbia,2026-03-20T12:42:18.724848
hydrometric-stations-active-and-discontinued,Hydrometric Stations - Active and Discontinued,BC active and discontinued hydrometric stations (surface water level and flow data) that are part of the provincial hydrometric network managed under a national program jointly administered under a federal-provincial cost-sharing agreement with Environment and Climate Change Canada (ECCC).   ,Environmental Monitoring and Analysis Branch,"MULTIPLE, KML, WMS","hydrology, hydrometric, real-time monitoring, stream flow",,,False,Open Government Licence - British Columbia,2025-03-07T14:07:04.475188
clever-model-mapping-application,CLEVER Model Mapping Application,"The CLEVER model is a hydrologic model used by the River Forecast Centre to forecast hydrologic conditions at locations around British Columbia. This mapping application provides mapped output from the CLEVER model 10-Day forecasts against assessed return period flows at Water Survey of Canada locations.

For detailed information on the CLEVER Model, see the Technical Reference Guide.",River Forecast Centre,OTHER,"AGO, BC, British Columbia, CLEVER, Canada, Flood, Hydrology, River Forecast Centre, Water, freshet",,,False,Access Only,2023-02-17T23:28:07.080219
flood-advisory-and-warning-notification-map,Flood Advisory and Warning Notification Map,"Map-based product of current Flood Warnings and Advisories issued by the River Forecast Centre.

The map includes the spatial extent of areas, such as regions or specific watersheds, that are under advisory/warning, with links to text version of the warning/advisory with greater detail.

Levels of Warnings/Advisories: 1. High Streamflow Advisory: River levels are rising or expected to rise rapidly, but that no major flooding is expected. Minor flooding in low-lying areas is possible. 2. Floo",River Forecast Centre,ARCGIS_REST,"AGO, BC, British Columbia, Canada, Flood, Flood Warnings, Hydrology, River Forecast Centre, Streamflow, Water, emergency management",,,False,Access Only,2023-02-17T23:13:01.922545
b-c-flood-advisory-warnings-and-notifications,B.C. Flood Advisory Warnings and Notifications,"Spatial data of current Flood Warnings and Advisories issued by the River Forecast Centre.

The map includes the spatial extent of areas, such as regions or specific watersheds, that are under advisory/warning, with links to text version of the warning/advisory with greater detail.

Levels of Warnings/Advisories: 1. High Streamflow Advisory: River levels are rising or expected to rise rapidly, but that no major flooding is expected. Minor flooding in low-lying areas is possible. 2. Flood Wat",River Forecast Centre,ARCGIS_REST,"AGO, BC, British Columbia, Canada, Flood, Flood Warnings, Hydrology, River Forecast Centre, Streamflow, Water",,,False,Access Only,2023-02-17T23:13:56.613518
british-columbia-regional-flood-frequency-analysis-web-application,British Columbia Regional Flood Frequency Analysis Web Application,This ArcGIS Online application displays the hydrometric stations and accompanying drainage areas analyzed as part of Bulletin 2020-1-RFFA described below. A frequency analysis was conducted on Annual Maximum Series (AMS) streamflow data collected at Water Survey of Canada (WSC) and United States Geological Survey (USGS) hydrometric gauge stations that met the following criteria for inclusion in the Bulletin 2020-1-RFFA study: at least 10 years or data (with 350 or more days of observations) abov,Water Management,"CSV, OTHER, ZIP","ArcGIS Online, Flood, Frequenct, Hydrometric, Regional, Streamflow",,,False,Open Government Licence - British Columbia,2025-07-30T21:05:23.920470
clever-model-data,CLEVER Model Data,"The CLEVER model is a hydrologic model used by the River Forecast Centre to forecast hydrologic conditions at locations around British Columbia. This map provides mapped output from the CLEVER model 10-Day forecasts against assessed return period flows at Water Survey of Canada locations.

Data includes: Water Survey of Canada Gauge Name and Number; station location (latitude/longitude); current stream discharge reading; current flow's annual peak-flow return period; CLEVER model maximum flow ",River Forecast Centre,ARCGIS_REST,"AGO, BC, British Columbia, CLEVER, Canada, Flood, Freshet, Hydrology, River Forecast Centre, Streamflow, Water",,,False,Access Only,2023-02-17T23:27:41.039843
wetland-and-riparian-potential-lower-fraser-valley,Wetland and Riparian Potential – Lower Fraser Valley,"The **Wetland and Riparian Potential – Lower Fraser Valley** dataset is a region wide assessment of wetland and riparian potential across British Columbia’s Lower Mainland summarized within a multi-scale [H3 hexagonal grid framework](https://h3geo.org). The mapping can be used to reveal areas most conducive to wetland formation and is classified into four simplified categories: *Water*, *Wetland*, *Upland/Anthropogenic*, and *Potential Wetland*.

The dataset area encompasses the Lower Mainland r",Knowledge Management,"PDF, OTHER, FGDB","Ecosystem Management, Ecosystem Mapping, Fraser Valley, Lower Mainland, Riparian, Wetland",,,False,Access Only,2026-03-13T22:42:48.899725
7-day-stream-flow-map,7-Day Stream flow Map,Map of stream flow conditions across British Columbia. Near real-time data from the Water Survey of Canada is analysed against stream flow metrics developed by the River Forecast Centre. Key data available on this map include: 1.) Comparison of current 7-day average stream flow as a percentage of historic median 7-day average stream flow over the same period of time 2.) Comparison of current 7-day average stream flow percentiles to drought indicator levels in the BC Drought Response Plan 3.) Tim,River Forecast Centre,ARCGIS_REST,"AGO, BC, British Columbia, Canada, Drought, Hydrology, Hydrometric, River Forecast Centre, Streamflow, Water",,,False,Access Only,2022-05-03T19:34:51.431367
atlas-of-canada-1-000-000-national-frameworks-data-roads,"Atlas of Canada 1,000,000 National Frameworks Data - Roads","DEPRECATED: Atlas of Canada National Scale Frameworks data are standardized national coverages of commonly used geospatial datasets at the 1:1 000 000 scale. A variety of framework layers (e.g. hydrology, roads, ferry routes, railways, administrative boundaries, census subdivisions, population ecumene, drainage areas, protected areas and Canadian place names) have been integrated so that their relative positions are correct. Hydrology (which includes coastline) is the base layer to which all oth",GeoBC Branch,ORACLE_SDE,"Ferry, Transportation, access road, road, road network",,,False,Access Only,2022-10-06T17:55:04.291663
community-watersheds-current,Community Watersheds - Current,"Boundaries (polygons) of areas designated as community watershed by government - that are all or part of the drainage area that is upslope of the lowest point from which water is diverted for human consumption by a licensed waterworks, if satisfied that, to protect the water that is diverted for human consumption, the area requires special management that is not otherwise provided for under this regulation or other enactment: to conserve the quality, quantity and timing of water flow; or to prev",Aquatic Ecosystems,"MULTIPLE, KML, WMS","Canada, Hydrology, community watershed, domestic water, drinking water, watershed",,,False,Open Government Licence - British Columbia,2025-05-12T12:41:04.201847
7-day-streamflow-data,7-Day Streamflow Data,Analysis of near real-time data from the Water Survey of Canada against stream flow metrics developed by the River Forecast Centre. Key data available include: 1.) Comparison of current 7-day average stream flow as a percentage of historic median 7-day average stream flow over the same period of time 2.) Comparison of current 7-day average stream flow percentiles to drought indicator levels in the BC Drought Response Plan 3.) Time of data update,River Forecast Centre,ARCGIS_REST,"AGO, Hydrology, River Forecast Centre, bc, british columbia, canada, drought, hydrometric, streamflow",,,False,Access Only,2022-05-03T19:39:37.612536
elf-model-map,ELF Model Map,"The Extrapolating Logarithmic Flow (ELF) Model is an empirical mathematical model for estimating a 30-day stream flow forecast during the summer low flow season at Water Survey of Canada hydrometric gauge locations in British Columbia.

This map provides mapped flow forecast output from the ELF model against assessed mean annual discharge and mean annual gauge level at Water Survey of Canada locations.",River Forecast Centre,ARCGIS_REST,"AGO, BC, British Columbia, Canada, Drought, ELF, Hydrology, Hydrometric, River Forecast Centre, Streamflow, Water, low flow",,,False,Access Only,2022-05-03T19:34:10.339763
ground-water-aquifers,Ground Water Aquifers,"Polygon features represent developed ground water aquifers in BC (that have been mapped). Most aquifer boundaries are delineated based on geology, hydrology and topographic information. Some aquifer boundaries stop at the border of BC mapsheet boundaries due to resource or data constraints at the time of mapping.",Water Protection and Sustainability,"MULTIPLE, XLSX, KML, WMS","Canada, Hydrology, aquifer, groundwater",,,False,Open Government Licence - British Columbia,2026-03-20T12:40:53.213203
elf-model-mapping-application,ELF Model Mapping Application,"The Extrapolating Logarithmic Flow (ELF) Model is an empirical mathematical model for estimating a 30-day stream flow forecast during the summer low flow season at Water Survey of Canada hydrometric gauge locations in British Columbia.

This mapping application provides mapped output from the ELF model against assessed mean annual discharge and mean annual gauge level at Water Survey of Canada locations.",River Forecast Centre,OTHER,"AGO, BC, British Columbia, Drought, Hydrology, Hydrometric, River Forecast Centre, Streamflow, Water, low flow",,,False,Access Only,2022-04-06T22:28:33.221158
current-streamflow-conditions-mapping-application,Current Streamflow Conditions Mapping Application,Mapping application of real-time stream flow conditions across British Columbia. Near real-time data from the Water Survey of Canada is analysed against stream flow metrics developed by the River Forecast Centre. Key data available on this map include: 1.) Comparison of current stream flow discharge against annual peak flow return period estimates 2.) Comparison of current stream flow as a percentage of gauge mean annual discharge,River Forecast Centre,OTHER,"AGO, BC, British Columbia, Canada, Drought, Flood, Hydrology, Hydrometric, River Forecast Centre, Streamflow, Water",,,False,Access Only,2022-04-06T22:28:31.229993
non-trim-hydrography,Non-TRIM Hydrography,"Province-wide SDE layer showing licensed water sources (streams and lakes), under the Water Act, (current and historical), not captured (displayed) on TRIM base mapping (or Freshwater Atlas base mapping). Includes an attribute for the internal Source Code number, which is associated with the (E-Licensing) stream name.",Water Management,MULTIPLE,"Canada, Hydrology, water licensing, water management, water rights",,,False,Open Government Licence - British Columbia,2026-03-20T12:43:36.608988
snow-basin-indices-mapping-application,Snow Basin Indices Mapping Application,"This is a mapping application of current snow basin indices across British Columbia. Snow basin index mapping is based on analysis from the River Forecast Centre, and is meant to accompany the Snow Conditions and Water Supply Bulletins that are published for data from January 1st, February 1st, March 1st, April 1st, May 1st, May 15th, June 1st and June 15th each year. Snow data collection is managed by the Ministry of Environment and Climate Change Strategy's Snow Program.",River Forecast Centre,OTHER,"AGO, BC, British Columbia, Canada, Climate, Drought, Flood, Hydrology, River Forecast Centre, Snow, Water",,,False,Access Only,2022-05-03T19:37:49.719753
mapping-application-of-7-day-average-streamflow,Mapping Application of 7-Day Average Streamflow,"Mapping application of stream flow conditions across British Columbia. Near real-time data from the Water Survey of Canada is analysed against stream flow metrics developed by the River Forecast Centre. Key data available on this map include:

1.) Comparison of current 7-day average stream flow as a percentage of historic median 7-day average stream flow over the same period of time

2.) Comparison of current 7-day average stream flow percentiles to drought indicator levels in the BC Drought",River Forecast Centre,OTHER,"AGO, BC, British Columbia, Canada, Drought, Hydrology, Low-flow, River Forecast Centre, Streamflow, Water",,,False,Access Only,2022-04-06T22:29:14.305799
coffee-model-mapping-application,COFFEE Model Mapping Application,"The COastal Fall Flood Ensemble Estimation (COFFEE) Model provides a 5-day real-time flow forecasts for select watersheds in coastal British Columbia, including Vancouver Island, South Coast, Central Coast and the North-West. The COFFEE model is  updated when a rainfall events occur during the autumn-winter storm season.

This mapping application provides mapped output from the CLEVER model against assessed return period flows at Water Survey of Canada locations.

For detailed information on",River Forecast Centre,OTHER,"AGO, BC, British Columbia, COFFEE, Canada, Coastal, Flood, Hydrology, River Forecast Centre, Streamflow, Water",,,False,Access Only,2022-04-06T22:28:29.237101
university-of-victoria-aquifer-stress-evaluation,University of Victoria Aquifer Stress Evaluation,"The scope of this project is to derive aquifer-scale estimates of annual volumes for groundwater withdrawal, recharge, and groundwater’s contribution to environmental flows as a means to provide screening level estimates of aquifer-scale stress using the groundwater footprint. The groundwater footprint (GF) is calculated for unconfined aquifers from aquifer-scale, steady-state estimates.
For more information see:

Forstner, T., Gleeson, T., Borrett, L., Allen, D.M., Wei, M., and Baye, A. 2018",Water Protection and Sustainability,XLSX,"Aquifer, EFN, UVic, University of Victoria, groundwater, groundwater abstraction, recharge, stress, withdrawal",,,False,Access Only,2018-09-10T17:17:34.799869
community-watersheds-restricted-access,Community Watersheds (Restricted Access),"This 1:20,000. scale inventory contains digital maps of community watershed boundaries. The watershed boundaries show the location of watersheds that supply communities with domestic water. These are meant to be used in conjunction with stream network map coverages from TRIM mapping. This view has additional Contact information.",Aquatic Ecosystems,MULTIPLE,"Canada, Hydrology, community watershed, domestic water, drinking water, watershed",,,False,Access Only,2025-05-12T12:40:44.710298
elf-model-data,ELF Model Data,"The Extrapolating Logarithmic Flow (ELF) Model is an empirical mathematical model for estimating a 30-day stream flow forecast during the summer low flow season at Water Survey of Canada hydrometric gauge locations in British Columbia.

This map provides mapped flow forecast output from the ELF model against assessed mean annual discharge and mean annual gauge level at Water Survey of Canada locations.

Data includes: Water Survey of Canada Gauge Name and Number; station location (latitude/l",River Forecast Centre,ARCGIS_REST,"AGO, BC, British Columbia, Canada, Drought, Hydrology, Hydrometric, River Forecast Centre, Streamflow, Water, low flow",,,False,Access Only,2022-05-03T19:38:35.307218
bc-major-basins-river-forecast-centre,BC Major Basins - River Forecast Centre,"Watershed boundaries for major river basins in British Columbia. Used for map products produced by the River Forecast Centre. Includes Fraser, Liard, Columbia, Skeena, Stikine, Thompson, Peace, Quesnel, Chilcotin, Nechako-Stuart and Nass Rivers.",River Forecast Centre,"ARCGIS_REST, SHP","AGO, BC, Boundaries, British Columbia, Canada, Hydrology, River, River Forecast Centre, Water, Watershed",,https://governmentofbc.maps.arcgis.com/home/item.html?id=18fd964242d3446db4334e07af17edaf,False,Access Only,2022-05-03T20:09:35.626950
atlas-of-canada-1-000-000-national-scale-place-names,"Atlas of Canada National Scale Data 1:1,000,000 - Place Names","DEPRECATED: Atlas of Canada National Scale Frameworks data are standardized national 
 	coverages of commonly used geospatial datasets at the 1:1,000,000 scale. A variety of framework layers (e.g. hydrology, roads, ferry routes, railways, administrative boundaries, census subdivisions, population ecumene, drainage areas, protected areas and Canadian place names) have been integrated so that their relative positions are correct. Hydrology (which includes coastline) is the base layer to which all",GeoBC Branch,ORACLE_SDE,"City, populated places, town",,,False,Access Only,2023-11-05T15:41:06.327730
flood-advisory-and-warning-notification-mapping-application,Flood Advisory and Warning Notification Mapping Application,"This is a mapping application for current Flood Warnings and Advisories issued by the River Forecast Centre.

The map includes the spatial extent of areas, such as regions or specific watersheds, that are under advisory/warning, with links to text version of the warning/advisory with greater detail.

Levels of Warnings/Advisories:
  1. High Streamflow Advisory: River levels are rising or expected to rise rapidly, but that no major flooding is expected. Minor flooding in low-lying areas is p",River Forecast Centre,OTHER,"AGO, BC, British Columbia, Canada, Flood, Flood Warnings, Hydrology, River Forecast Centre, Streamflow, Water, emergency management",,,False,Access Only,2023-02-17T23:14:37.208546
trim-water-annotation,TRIM Water Annotation,"Water annotation (e.g. lake and river names, etc.). The TRIM program produces digital maps, which is a collection of coverages to conform with the BC Geographic System layout. TRIM mapping consists of 7,027 mapsheets covering the province of British Columbia at a scale of 1:20 000.",GeoBC Branch,MULTIPLE,"Canada, Drainage, Hydrology, TRIM, annotation, basemap, topographic map",,,False,Access Only,2021-12-10T22:36:39.615557
trim-stream-lines-1-5-000,"TRIM Stream Lines - 1:5,000","1:5,000 Stream Lines for IDMI. The TRIM program produces digital maps, which is a collection of coverages to conform with the BC Geographic System layout. TRIM mapping consists of 7,027 mapsheets covering the province of British Columbia at a scale of 1:20 000.",GeoBC Branch,MULTIPLE,"Canada, Hydrology, TRIM, basemap, stream, topographic map",,,False,Access Only,2021-12-10T22:36:38.239444
